{
  "$schema": "https://json-schema.org/draft/2020-12/schema",
  "$id": "https://github.com/Furkiozknn/ajans-os/contracts/span.schema.json",
  "title": "Gözlem span sözleşmesi",
  "description": "Observability'nin tek çıktı birimi. Bir koşuda olan biten bu kayıtlarla anlatılır. Span TÜRETİLMİŞ bir gözlemdir, doğruluk kaynağı DEĞİLDİR — ilerlemenin kaydı task.schema.json'daki step_records'tır (ADR-003). Bu yüzden span kaybı ilerleme kaybı sayılmaz. Token ve para muhasebesi yalnızca `inference` sınırında tutulur; ajan span'i model bilmez (changelog.d/469.breaking.md). Alan adları İngilizce, açıklamalar Türkçe (ADR-000 K9). OTel GenAI adları bu şemaya gömülmez, `otel_map` çeviri tablosuyla eşlenir.",
  "type": "object",
  "additionalProperties": false,
  "required": [
    "contract_version",
    "span_id",
    "trace_id",
    "parent_span_id",
    "run_id",
    "operation",
    "name",
    "started_at",
    "outcome"
  ],
  "properties": {
    "contract_version": {
      "description": "Bu sözleşmenin sürümü. Şema değişirse burası değişir; eski kayıtlar eski sürümle okunur.",
      "const": "1.0"
    },
    "span_id": { "$ref": "#/$defs/kebab_id" },
    "trace_id": {
      "description": "Bir koşunun tüm span'lerini bağlayan kimlik. run_id ile birebir eşleşir; ayrı tutulmasının sebebi OTel dışa aktarımının kendi trace kimliğini istemesidir.",
      "$ref": "#/$defs/kebab_id"
    },
    "parent_span_id": {
      "description": "Üst span. AÇIK bir alandır, OTel trace context'ine bırakılmaz — OTel GenAI'de parent/child taşıyan bir alan yoktur, ilişki trace context varsayımına bırakılmıştır (`events.yaml:18`). Biz o varsayıma güvenmiyoruz: dışa aktarım katmanı düşse bile hiyerarşi kayıtta durmalı. Kök span'de null.",
      "type": ["string", "null"],
      "pattern": "^[a-z0-9]+(-[a-z0-9]+)*$",
      "maxLength": 80
    },
    "run_id": { "$ref": "#/$defs/kebab_id" },
    "step_id": {
      "description": "Span'in hangi adıma ait olduğu (task.schema.json graph.steps[].id). Koşu seviyesindeki kök span'de yoktur.",
      "$ref": "#/$defs/kebab_id"
    },

    "operation": {
      "description": "Span'in sınıfı. Bu kapalı liste bilinçlidir: yeni bir sınıf eklemek, o sınıfın hangi sayacı beslediğini yazmayı zorunlu kılar (kural 6 — tüketicisi olmayan sinyal üretilmez). `inference` tek modele ve tek çağrıya karşılık gelen sınırdır; token/maliyet yalnızca orada tutulur.",
      "type": "string",
      "enum": [
        "run",
        "invoke_agent",
        "inference",
        "execute_tool",
        "permission_check",
        "evaluate",
        "critique",
        "memory_write",
        "recovery"
      ]
    },
    "name": {
      "description": "İnsan okur span adı. OTel deseni izlenir: `invoke_agent {ajan}`, `execute_tool {arac}` (`spans-deprecated.yaml:547-548`, `spans-deprecated.yaml:610-612`).",
      "type": "string",
      "minLength": 2,
      "maxLength": 200
    },
    "started_at": { "$ref": "#/$defs/zaman" },
    "ended_at": { "$ref": "#/$defs/zaman" },
    "duration_ms": {
      "description": "Gecikme. Bilinmiyorsa null — sıfır değil (kural 11'in gecikmeye uygulanışı; ölçülmemiş süre 'anında' demek değildir).",
      "type": ["integer", "null"],
      "minimum": 0
    },

    "actor": {
      "description": "Span'i doğuran taraf. Ajan doğrudan araç çağıramaz (K6); `execute_tool` span'inin actor'ü orkestratör ya da bileşendir.",
      "type": "object",
      "additionalProperties": false,
      "required": ["kind", "id"],
      "properties": {
        "kind": { "type": "string", "enum": ["agent", "orchestrator", "component"] },
        "id": { "$ref": "#/$defs/kebab_id" }
      }
    },

    "model": {
      "description": "Yalnızca `inference` span'inde bulunur. Ajan span'i model BİLMEZ — OTel bu inceltmeyi üç kırıcı değişiklikle yaptı (`changelog.d/242.breaking.md`, `changelog.d/289.breaking.md`, `changelog.d/322.breaking.md`); sağlayıcı bilgisi ve para muhasebesi tek bir alt sınıra aittir.",
      "type": "object",
      "additionalProperties": false,
      "required": ["provider", "name"],
      "properties": {
        "provider": {
          "description": "Serbest string, kapalı enum DEĞİL. OTel'in kapalı `gen_ai.provider.name` listesi (`registry-deprecated.yaml:65-160`) bizde gereksiz bakım yüküdür; sağlayıcı seti iç kullanımda değişkendir.",
          "type": "string",
          "minLength": 2,
          "maxLength": 60
        },
        "name": { "type": "string", "minLength": 1, "maxLength": 120 },
        "transport": {
          "description": "Sağlayıcıya özel taşıma ayarı (`api_base` gibi). Seçim mantığı sağlayıcıdan habersiz kalır, taşıma katmanı kalmaz — sınır buraya çizilir (İ5 Ö1).",
          "type": "object"
        }
      }
    },

    "usage": {
      "description": "Token sayaçları. YALNIZCA `inference` span'inde; ajan seviyesinde toplanan sayı yanıltıcıdır (`changelog.d/469.breaking.md`: cache kırılımları modeller ve çağrılar arasında toplanınca yanıltıcı olur, tüketici bunları çağrı span'lerinden toplamalıdır). Toplama işi tüketicinin, üretim noktası çağrı sınırının.",
      "type": "object",
      "additionalProperties": false,
      "required": ["input_tokens", "output_tokens"],
      "properties": {
        "input_tokens": { "type": ["integer", "null"], "minimum": 0 },
        "output_tokens": { "type": ["integer", "null"], "minimum": 0 },
        "cache_read_input_tokens": { "type": ["integer", "null"], "minimum": 0 },
        "cache_write_input_tokens": { "type": ["integer", "null"], "minimum": 0 },
        "reasoning_output_tokens": { "type": ["integer", "null"], "minimum": 0 },
        "extra": {
          "description": "BEKLEME ODASI, çöp kutusu değil. Bir sağlayıcıya özel sayaç buraya yazılır; iki bağımsız sağlayıcı aynı kavramı taşımaya başlayınca çekirdek alana terfi eder ve `contract_version` artar. OTel'de cache token'ları tam olarak böyle terfi etti (`registry.yaml:301`, `registry.yaml:308`). Terfi etmemiş alan altı ay sonra silinir; kimse okumuyorsa sinyal değildir (kural 6).",
          "type": "object"
        }
      }
    },

    "cost": {
      "description": "Para. Hiçbir standart USD taşımaz — OTel deposunda `cost|price|usd|dollar` araması sıfır sonuç verir, bu kalıcı bir tasarım tercihidir. Bu yüzden bu alan bizim icadımızdır ve fiyat tablosuna bağlanır. Yalnızca `inference` span'inde.",
      "type": "object",
      "additionalProperties": false,
      "required": ["usd", "price_table"],
      "properties": {
        "usd": {
          "description": "Bilinmeyen maliyet null, SIFIR DEĞİL (kural 11 / AP10). Sıfır yazmak, ölçülmemiş parayı harcanmamış para gibi gösterir ve bütçe sayacını sessizce yanıltır.",
          "type": ["number", "null"],
          "minimum": 0
        },
        "price_table": {
          "description": "Maliyeti üreten fiyat tablosunun kimliği ve içerik özeti. Tablo VERİDİR, koda gömülmez (kural 11). Özet tutulur ki bir ay sonra 'bu sayı hangi fiyatla çıktı' sorusu cevaplanabilsin — Langfuse (`schema.prisma:784-839`) ve LiteLLM'in ikisinde de bu iz yok, güncelleme mekanizmaları belgesiz kaldı.",
          "type": "object",
          "additionalProperties": false,
          "required": ["version", "digest"],
          "properties": {
            "version": { "type": "string", "minLength": 1, "maxLength": 40 },
            "digest": { "$ref": "#/$defs/digest" },
            "updated_at": { "$ref": "#/$defs/zaman" }
          }
        },
        "unknown_reason": {
          "description": "`usd` null ise ZORUNLU. 'Bilmiyorum' kabul edilir, sessiz bilmemek edilmez.",
          "type": "string",
          "enum": ["fiyat-tablosunda-yok", "usage-alinmadi", "olculmedi"]
        }
      }
    },

    "outcome": {
      "description": "Span'in sonucu. Hata TÜRÜ ile hata METNİ ayrı tutulur — iki bağımsız proje birbirinden habersiz aynı ilkeye ulaştı (`runner.py:22-26` ayrı `error_type` alanı; `cooldown_handlers.py:205-251` saf fonksiyonda 429/401 ile diğer 4xx ayrımı). Çağıran string eşlemeden dallanabilmelidir.",
      "type": "object",
      "additionalProperties": false,
      "required": ["status"],
      "properties": {
        "status": { "type": "string", "enum": ["ok", "hata", "kesildi"] },
        "error_type": { "$ref": "#/$defs/hata_turu" },
        "error_message": { "type": "string", "maxLength": 2000 }
      }
    },

    "shadow": {
      "description": "Gölge mod. true ise bu span'in ürettiği sinyal HİÇBİR kararın girdisi olamaz; yalnızca ölçülür (AP5 → kural 6). Ölçülmemiş detektör gölge modda başlar. Sağlık sinyali üretip kullanmamak ile gölge mod farklı şeylerdir: gölge mod geçicidir ve çıkış ölçütü yazılıdır.",
      "type": "boolean",
      "default": false
    },

    "content": {
      "description": "Prompt/çıktı metni. VARSAYILAN OLARAK YOKTUR — OTel'in `opt_in` deseni (`spans-deprecated.yaml:127,129,131,133`) doğrudan alınıyor; PII riskini spec seviyesinde çözen basit ve doğru desen. Bu alan varsa `content_recording` açıkça `acik` olmalıdır.",
      "type": "object",
      "additionalProperties": false,
      "properties": {
        "input": { "type": "string" },
        "output": { "type": "string" },
        "truncated": { "type": "boolean" },
        "raw_ref": { "type": "string" }
      }
    },
    "content_recording": {
      "description": "İçerik kaydının açık olup olmadığı. Varsayılan `kapali`. `acik` yalnızca yapılandırmayla verilir; kayıt bu alanı taşır ki sonradan 'bu koşuda içerik toplandı mı' sorusu kayda bakarak cevaplanabilsin.",
      "type": "string",
      "enum": ["kapali", "acik"],
      "default": "kapali"
    },

    "otel_map": {
      "description": "Bu span'in OTel GenAI karşılıkları. Ad ÇEVİRİ TABLOSUNUN ARKASINDA durur, koda gömülmez: GenAI semconv'a sözleşme olarak bağlanılamaz, `changelog.d/` altında yedi kırıcı parça var ve biri doğrudan yeniden adlandırma (`changelog.d/440.breaking.md`). Tablo burada durursa spec kırıldığında tek yer değişir.",
      "type": "object",
      "additionalProperties": false,
      "properties": {
        "operation_name": { "type": "string" },
        "span_kind": { "type": "string", "enum": ["client", "internal", "server"] },
        "semconv_version": { "type": "string" }
      }
    },

    "attributes": {
      "description": "Sağlayıcıya ya da bileşene özel ek alanlar. `usage.extra` ile aynı terfi kuralına tabidir: uzantı katmanı hiç boşalmaz ama içindeki alan kalıcı değildir.",
      "type": "object"
    }
  },

  "$defs": {
    "kebab_id": {
      "type": "string",
      "pattern": "^[a-z0-9]+(-[a-z0-9]+)*$",
      "minLength": 2,
      "maxLength": 80
    },
    "zaman": {
      "type": "string",
      "pattern": "^[0-9]{4}-[0-9]{2}-[0-9]{2}T[0-9]{2}:[0-9]{2}:[0-9]{2}(Z|[+-][0-9]{2}:[0-9]{2})$"
    },
    "digest": {
      "description": "İçerik özeti: algoritma öneki + onaltılık değer.",
      "type": "string",
      "pattern": "^sha256:[0-9a-f]{64}$"
    },
    "hata_turu": {
      "description": "Makine okur hata sınıfı. Serbest metinden ayrıdır.",
      "type": "string",
      "enum": [
        "SEMA_IHLALI",
        "DOGRULAMA_KALDI",
        "IZIN_REDDI",
        "BUTCE_ASIMI",
        "ZAMAN_ASIMI",
        "SAGLAYICI_HATASI",
        "IC_HATA"
      ]
    }
  }
}
