{
  "contract_version": "1.0",
  "span_id": "span-kosu-0001",
  "trace_id": "kosu-2026-09-08-1510",
  "parent_span_id": null,
  "run_id": "kosu-2026-09-08-1510",
  "operation": "run",
  "name": "run gozlem-mimarisi",
  "started_at": "2026-09-08T15:10:00+03:00",
  "ended_at": "2026-09-08T15:41:12+03:00",
  "duration_ms": 1872000,
  "actor": { "kind": "orchestrator", "id": "orkestrator" },
  "outcome": { "status": "ok" },
  "content_recording": "kapali",
  "otel_map": { "operation_name": "invoke_workflow", "span_kind": "internal" }
}
