{
  "contract_version": "1.0",
  "span_id": "span-cagri-0019",
  "trace_id": "kosu-2026-09-08-1510",
  "parent_span_id": "span-ajan-0018",
  "run_id": "kosu-2026-09-08-1510",
  "step_id": "ozet-cikar",
  "operation": "inference",
  "name": "inference yerel-model",
  "started_at": "2026-09-08T15:31:40+03:00",
  "ended_at": "2026-09-08T15:31:58+03:00",
  "duration_ms": 18004,
  "actor": { "kind": "component", "id": "model-router" },
  "model": { "provider": "yerel-gateway", "name": "qwen3-30b" },
  "usage": {
    "input_tokens": 2100,
    "output_tokens": 640,
    "extra": { "gateway_queue_ms": 320 }
  },
  "cost": {
    "usd": null,
    "unknown_reason": "fiyat-tablosunda-yok",
    "price_table": {
      "version": "2026-09-01",
      "digest": "sha256:a063b89cde12736c969bea8d7eb0dece339dcdb1629b724fb1c07ce7adcff465"
    }
  },
  "outcome": { "status": "ok" },
  "content_recording": "kapali"
}
