{
  "contract_version": "1.0",
  "span_id": "span-izin-0011",
  "trace_id": "kosu-2026-09-08-1510",
  "parent_span_id": "span-arac-0010",
  "run_id": "kosu-2026-09-08-1510",
  "step_id": "belge-yaz",
  "operation": "permission_check",
  "name": "permission_check Write",
  "started_at": "2026-09-08T15:23:02+03:00",
  "ended_at": "2026-09-08T15:23:02+03:00",
  "duration_ms": 14,
  "actor": { "kind": "component", "id": "permission-manager" },
  "outcome": { "status": "ok" },
  "shadow": false,
  "content_recording": "kapali",
  "attributes": {
    "decision": "ALLOW",
    "decision_id": "izin-0001",
    "tool": "Write"
  }
}
